{
  "schemaVersion": 1,
  "id": "week-2026-09-14",
  "sourceID": "focus-rhythm:september-14-22",
  "timeZoneIdentifier": "America/Toronto",
  "horizon": { "startDay": "2026-09-14", "endDayExclusive": "2026-09-23" },
  "availability": [
    { "day": "2026-09-14", "windows": [{ "start": "2026-09-14T09:00:00-04:00", "end": "2026-09-14T17:00:00-04:00" }] },
    { "day": "2026-09-15", "windows": [{ "start": "2026-09-15T09:00:00-04:00", "end": "2026-09-15T17:00:00-04:00" }] },
    { "day": "2026-09-17", "windows": [{ "start": "2026-09-17T09:00:00-04:00", "end": "2026-09-17T17:00:00-04:00" }] },
    { "day": "2026-09-22", "windows": [{ "start": "2026-09-22T09:00:00-04:00", "end": "2026-09-22T17:00:00-04:00" }] }
  ],
  "tasks": [
    { "id": "control", "sourceID": "sept:control", "title": "Control condition", "originalEstimateSeconds": 5400, "remainingEstimateSeconds": 5400, "order": 0, "deadline": "2026-09-15T10:00:00-04:00", "prerequisiteTaskIDs": [], "categoryTags": ["Throughline"] },
    { "id": "formative", "sourceID": "sept:formative", "title": "Formative-study review", "originalEstimateSeconds": 7200, "remainingEstimateSeconds": 7200, "order": 1, "deadline": "2026-09-15T10:00:00-04:00", "prerequisiteTaskIDs": ["control"], "categoryTags": ["Throughline"] },
    { "id": "sketches", "sourceID": "sept:sketches", "title": "Sketches", "originalEstimateSeconds": 5400, "remainingEstimateSeconds": 5400, "order": 2, "deadline": "2026-09-17T11:00:00-04:00", "prerequisiteTaskIDs": ["formative"], "categoryTags": ["Throughline"] },
    { "id": "vision", "sourceID": "sept:vision", "title": "LLM vision", "originalEstimateSeconds": 7200, "remainingEstimateSeconds": 7200, "order": 3, "deadline": "2026-09-17T11:00:00-04:00", "prerequisiteTaskIDs": ["sketches"], "categoryTags": ["Throughline"] },
    { "id": "implementation", "sourceID": "sept:implementation", "title": "Implementation issues", "originalEstimateSeconds": 10800, "remainingEstimateSeconds": 10800, "order": 4, "deadline": "2026-09-22T10:00:00-04:00", "prerequisiteTaskIDs": ["vision"], "categoryTags": ["Throughline", "programming"] },
    { "id": "build", "sourceID": "sept:build", "title": "Build", "originalEstimateSeconds": 5400, "remainingEstimateSeconds": 5400, "order": 5, "deadline": "2026-09-22T10:00:00-04:00", "prerequisiteTaskIDs": ["implementation"], "categoryTags": ["Throughline", "programming"] },
    { "id": "nserc", "sourceID": "sept:nserc", "title": "NSERC revision", "originalEstimateSeconds": 14400, "remainingEstimateSeconds": 14400, "order": 6, "deadline": "2026-09-22T17:00:00-04:00", "prerequisiteTaskIDs": [], "categoryTags": ["writing", "proposal"] },
    { "id": "grading", "sourceID": "sept:grading", "title": "Conditional grading", "originalEstimateSeconds": 7200, "remainingEstimateSeconds": 7200, "order": 7, "prerequisiteTaskIDs": [], "categoryTags": ["grading"] }
  ],
  "allocations": [],
  "fixedCommitments": [
    { "id": "jian-15", "sourceID": "sept:jian-15", "title": "Jian checkpoint", "time": { "start": "2026-09-15T10:00:00-04:00", "end": "2026-09-15T10:30:00-04:00" } },
    { "id": "fan-17", "sourceID": "sept:fan-17", "title": "Fan checkpoint", "time": { "start": "2026-09-17T11:00:00-04:00", "end": "2026-09-17T11:30:00-04:00" } },
    { "id": "jian-22", "sourceID": "sept:jian-22", "title": "Jian checkpoint", "time": { "start": "2026-09-22T10:00:00-04:00", "end": "2026-09-22T10:30:00-04:00" } },
    { "id": "lab-18", "sourceID": "sept:lab-18", "title": "Lab meeting", "time": { "start": "2026-09-18T14:00:00-04:00", "end": "2026-09-18T15:00:00-04:00" } }
  ],
  "localState": { "classifications": {
    "control": { "quadrant": "urgentImportant", "workKind": "programming", "planningState": "actionableTask", "isConditionReady": true },
    "formative": { "quadrant": "urgentImportant", "workKind": "writing", "planningState": "actionableTask", "isConditionReady": true },
    "sketches": { "quadrant": "urgentImportant", "workKind": "writing", "planningState": "actionableTask", "isConditionReady": true },
    "vision": { "quadrant": "urgentImportant", "workKind": "programming", "planningState": "actionableTask", "isConditionReady": true },
    "implementation": { "quadrant": "urgentImportant", "workKind": "programming", "planningState": "actionableTask", "isConditionReady": true },
    "build": { "quadrant": "urgentImportant", "workKind": "programming", "planningState": "actionableTask", "isConditionReady": true },
    "nserc": { "quadrant": "notUrgentImportant", "workKind": "proposal", "planningState": "actionableTask", "isConditionReady": true },
    "grading": { "quadrant": "urgentImportant", "workKind": "grading", "planningState": "conditionalTask", "isConditionReady": false }
  } }
}
